109;46147;AVENGERS (Chapeau melon) (1962 - Saison 2 - Vol. 2) (THE );1962;DIVERS;D'après S.NEWMAN, mus.L.JOHNSON/ Int.P.McNEE/ H.BLACKMAN/ J.STEVENS (et bottes de cuir);Trois épisodes : Missive à mort, Warlock et Combustible 23.;DVD 5 / Mono / 4/3 / LG : Fra, Eng / S-T : Fra / Chapitrage.;POL;3x52';2004-12-30;advengers02_01.jpg;0000-00-00;NULL
110;45441;DRAGON LORD;1982;CHAN J.;Scé.J.CHAN, B.WONG, T.KING-SANG,mus. P.CHEN/ Int.J.CHAN/ C.HUI-MIN/ S.YIM;Dragon et son copain mènent une vie oisive, se défient au sport, se disputent les faveurs des filles jusqu'au jour où ils croisent la route de contrebandiers et deviennent des héros;DVD 5 / 16/9 compatible 4/3 / Son Arkamys 5.1 / LG : Fra / Biographie et filmographie de Jackie Chan, bande-annonce, lien Internet;AVE;90';2004-12-30;dragonlord.jpg;0000-00-00;NULL
111;45449;FLIC DE HONGKONG (LE );1983;HUNG S.;Scé. B.WONG,L.KIN, S.CHEUK HON,mus.M.LAI/ Int.J.CHAN/ S.HUNG/ R.NG/ Y.BIAO;L'inspecteur Ma, star du sport, est accusé de meurtres commis sans vergogne par Tsui Ma s'enfuit et mène l'enquête jusqu'au combat final !;DVD 5 / 16/9 compatible 4/3 / Son Arkamys 5.1 / LG : Fra / Biographie et filmographie de Jackie Chan, bande-annonce, lien Internet;AVE;107';2004-12-30;leflicdehongkong.jpg;0000-00-00;NULL
112;38786;MARIN DES MERS DE CHINE (LE );1983;CHAN J.;Scé. J.CHAN, E.TANG/ Int. J.CHAN/ S.HUNG/ Y.BIAO/ D.WEI/MARS;Une des réussites de Jackie Chan qui puise son inspiration dans la culture chinoise sans oublier pour autant Buster Keaton ou Harold Lloyd;"DVD 5 / 16/9 compatible 4/3 / Son Arkamys 5.1 / LG : Fra / Biographie et filmographie de Jackie Chan, bande-annonce, lien Internet
	";AVE;105';2004-12-30;lemarindesmers.jpg;0000-00-00;NULL
113;38782;POLICE STORY;1985;CHAN J.;Scé.E.TANG,mus.K.BASSINSON/ Int.J.CHAN/ B.LIN/ M.CHEUNG/ K.TONG;Un officier de police est chargé de protéger le témoin clé dans une affaire de drogue Une comédie d'aventures qui s'éloigne des films d'arts martiaux traditionnels;DVD 5 / 16/9 compatible 4/3 / Son Arkamys 5.1 / LG : Fra / Biographie et filmographie de Jackie Chan, bande-annonce, lien Internet;AVE;85';2004-12-30;policestory01.jpg;0000-00-00;NULL
114;38783;POLICE STORY 2;1993;CHAN J.;Scé. E.TANG,mus.E.BASSINSON/ nt.J.CHAN/ B.LIN/ M.CHEUNG/ B.TUNG;Alors qu'il vient de démanteler un cartel de la drogue, Jackie Chan reçoit un blâme pour ses méthodes peu orthodoxes Il est prêt à quitter la police;DVD 5 / 16/9 compatible 4/3 / Son Arkamys 5.1 / LG : Fra / Biographie et filmographie de Jackie Chan, bande-annonce, lien Internet;AVE;80';2004-12-30;policestory02.jpg;0000-00-00;NULL
115;29753;DOGMA;1999;SMITH K.;Scé. K.SMITH, mus.H.SHORE/Int. B.AFFLECK/ M.DAMON/ L.FIORENTINO;Un catéchisme new-look dans un univers BD trash pour une nouvelle version de l'Apocalypse Deux heures de délire halluciné et décalé, trop c'est trop !;DVD 5 / 16/9 compatible 4/3 / LG : Fra, Eng / S-T : Fra / Chapitrage, bande-annonce, filmographies, interview.;CDR;120';2004-12-30;dogma.jpg;0000-00-00;NULL
116;40790;FRIENDS : Saison 2 - A - 1 à 6;1994;DIVERS;Créé par M.KAUFFMAN, D.KRANE/Int.J.ANISTON/M.LE BLANC/C.COX/ M.PERRY/ L.KUDROW/ D.SCHWIMMER;Les aventures de Chandler, Joey, Phoebe, Ross, Rachel et Monica, une série pour les 20/35 ans, qui donne un aperçu de la vie de jeunes New-Yorkais;DVD 10 / 4/3 / LG : Fra, Eng / S-T : Fra, Eng, Ita, Ger, Spa, Gre, Cze, Bul, Rum + Ita, Ger pour malentendants / Clip.;COM;6x22';2004-12-30;friends02_01.jpg;0000-00-00;
117;40790;FRIENDS : Saison 2 - B - 7 à 12;1994;DIVERS;Créé par M.KAUFFMAN, D.KRANE/Int.J.ANISTON/M.LE BLANC/C.COX/ M.PERRY/ L.KUDROW/ D.SCHWIMMER;Les aventures de Chandler, Joey, Phoebe, Ross, Rachel et Monica, une série pour les 20/35 ans, qui donne un aperçu de la vie de jeunes New-Yorkais;DVD 10 / 4/3 / LG : Fra, Eng / S-T : Fra, Eng, Ita, Ger, Spa, Gre, Cze, Bul, Rum + Ita, Ger pour malentendants / Clip.;COM;6x22';2004-12-30;friends02_02.jpg;0000-00-00;NULL
118;40790;FRIENDS : Saison 2 - C - 13 à 18;1994;DIVERS;Créé par M.KAUFFMAN, D.KRANE/Int.J.ANISTON/M.LE BLANC/C.COX/ M.PERRY/ L.KUDROW/ D.SCHWIMMER;Les aventures de Chandler, Joey, Phoebe, Ross, Rachel et Monica, une série pour les 20/35 ans, qui donne un aperçu de la vie de jeunes New-Yorkais;DVD 10 / 4/3 / LG : Fra, Eng / S-T : Fra, Eng, Ita, Ger, Spa, Gre, Cze, Bul, Rum + Ita, Ger pour malentendants / Clip.;COM;6x22';2004-12-30;friends02_03.jpg;0000-00-00;NULL
119;40790;FRIENDS : Saison 2 - D - 19 à 24;1994;DIVERS;Créé par M.KAUFFMAN, D.KRANE/Int.J.ANISTON/M.LE BLANC/C.COX/ M.PERRY/ L.KUDROW/ D.SCHWIMMER;Les aventures de Chandler, Joey, Phoebe, Ross, Rachel et Monica, une série pour les 20/35 ans, qui donne un aperçu de la vie de jeunes New-Yorkais;DVD 10 / 4/3 / LG : Fra, Eng / S-T : Fra, Eng, Ita, Ger, Spa, Gre, Cze, Bul, Rum + Ita, Ger pour malentendants / Clip.;COM;6x22';2004-12-30;friends02_04.jpg;0000-00-00;NULL
120;49945;LAROQUE/PALMADE - Ils s'aiment;1997;DIVERS;Palmade / Laroque;Mise en scène M.ROBIN et P.PALMADE/Int.P.PALMADE/M.LAROQUE;DVD 9 / 16/9 compatible 4/3 / Son dolby digital 5.0 / LG : Fra / S-T : aucun / Menus interactifs, accès direct aux scènes par le chapitrage, interviews, karaoké.;COM;120';2004-12-30;ilssaiment01.jpg;0000-00-00;NULL
121;44081;LAROQUE/PALMADE - Ils se sont aimés;2002;BERGERE S.;PALMADE/LAROQUE;Après Ils s'aiment, Robin et Palmade tentent de répondre à la question Y a t-il une vie après le divorce ?, à travers l'histoire d'Isabelle et Martin, un couple en pleine crise;DVD 9 / 16/9 compatible 4/3 / Son dolby digital 5.0 / LG : Fra / S-T : aucun / Menus interactifs, accès direct aux scènes par le chapitrage, interviews, karaoké.;COM;120';2004-12-30;ilssesontaimes01.jpg;0000-00-00;NULL
122;53818;MANUSCRIT TROUVE A SARAGOSSE (v. intégrale restaurée) (LE );1964;HAS W.J.;D'après J.POTOCKI, scé.T.KWIATKOWSKI, mus. K.PENDERECKY/ Int.Z.CYBULSKI/ K.OPALINSKI;Restauré par M. Scorcese en 1996, une adaptation brillante du célèbre roman, parcours labyrinthique qui tient en haleine et émerveille sans cesse Suspense, rêve, féérie et humour;DVD 9 / 16/9 comp. 4/3 / S-T : Fra, Eng / Chapitrage, filmographie du réalisateur W.J.Has.;FAN;180';2004-12-30;manuscrit.jpg;0000-00-00;NULL
123;21277;MARS ATTACKS !;1997;BURTON T.;D'après TOPPS, scé.J.GEMS, mus.D.ELFMAN/ Int.J.NICHOLSON/ G.CLOSE/ A.BENING/ P.BROSNAN/ D.DeVITO;Un film drôle, souvent très beau, parfois très méchant Une machine infernale et délirante, fourmillant d'idées, jubilatoire mais aussi un peu vaine; 16/9 / LG : Fra, Eng, Ita / S-T : Fra, Eng, Ita, Nld, Spa, Por, Ara + Eng pour malentendants.;SFI;102';2004-12-30;marsattacks.jpg;0000-00-00;NULL
124;39113;MULHOLLAND DRIVE;2000;LYNCH D.;Scé.D.LYNCH, mus.A.BADALAMENTI/Int.N.WATTS/ L.E.HARRING/ J.THEROUX/ A.MILLER;Sur le cinéma, cette fascinante cité des rêves, un film aux multiples lectures, déroutant, éblouissant, labyrinthique, somptueux, vénéneux, vertigineux, lynchien donc;DVD 9 / 16/9 compatible 4/3 / Son dolby digital 5.1 / LG : Fra, Eng / S-T : Fra / Option chapitrage aléatoire;CDR;146';2004-12-30;mulhollanddrive.jpg;0000-00-00;NULL
125;53271;NOS MEILLEURES ANNEES;2002;GIORDANA M. T.;Scé. S.PETRAGLIA, S.RULLI/ Int. L.LO CASCIO/ A.BONI/ S.BERGAMASCO/ F.GIGUNI...;Une saga familiale tourbillonnante quiretrace quarante ans d'histoire italienne Une fresque attachante, lyrique, sans mièvrerie Une belle réussite de la télévision;LG : Ita, Fra / S-t : Fra / Making of, biofilmographie et interview du réal., du prod., du scén., un clip par décennie, bande-annonce, arbre généalogique de la famille Carati.;CDR;360';2004-12-30;nosmeilleuresannees.jpg;0000-00-00;NULL
126;52205;NULS, L'INTEGRULE (LES );2003;BERBERIAN A.;LES NULS;"*(C'est presque comme l'intégrale, mais avec un U) Au programme, huit années de télé (1987 à 1995)
	

avec des extraits sélectionnés par Les Nuls : Objectif Nul, Le JTN, TVN 595, L'ABCD, Histoire(s) de la Télévision, Les Nuls, l'émission";DVD 9 / 4/3 / Son stéréo 2.0 / LG : Fra / S-T : aucun / Bêtisiers, autres surprises inédites.;COM; 240';2004-12-30;lesnullintegrule.jpg;0000-00-00;NULL
127;30809;ROSETTA;1999;DARDENNE L. / DARDEN J.-P.;Scé. L.DARDENNE, J.-P.DARDENNE/Int.E.DEQUENNE/ F.RONGIONE/ A.YERNAUX/ O.GOURMET;Caméra à l'épaule et au poing, les frères Dardenne gagnent la Palme d'or en filmant le combat poignant et acharné de Rosetta en quête de dignité;16/9 compatible 4/3 / LG : Fra / Chapitrage, bande-annonce, notes de production, filmographie des réalisateurs, lien Internet.;CDR;90';2004-12-30;rosetta.jpg;0000-00-00;NULL
128;58280;SHARA;2003;KAWASE N.;Scé.N.KAWASE,mus.UA/Int. K.FUKUNAGA/ Y.HYOUDO/ N.KAWASE...;Une famille terrassée par la mort d'un enfant permet d'explorer le privé et les mythes, l'intime et les codes culturels japonais si singuliers et si universels Des séquences inoubliables;1.85, 16/9 / LG : Jap / S-T : Fra.;CDR;101';2004-12-30;shara.jpg;0000-00-00;NULL
129;58150;SHREK - L'aventure continue + 3D;2001;ADAMSON A. / JENSON V.;D'après W.STEIG, scé. T.ELLIOTT, T.ROSSIO, J.STILLMAN,mus. H.GREGSON-WILLIAMS, J.POWELL;L'ogre Shrek doit sauver une princesse s'il veut retrouver la tranquillité dans son marais Conte parodique réussi en images de synthèse (Contient 4 paires de lunettes 3D).;2 DVD 9 / 16/9 / LG : Eng, Fra, Nld / S-T : Eng, Fra, Nld / DVD1 : scène spéciale DVD, biographies, doublage du film dans le monde, interviews des personnages, notes de production;ANI;90';2004-12-30;shrek01.jpg;0000-00-00;NULL
130;58381;VAN HELSING;2003;SOMMERS S.;Scé.S.SOMMERS, mus.A.SILVESTRI /Int.H.JACKMAN/ K.BECKINSALE/ R.ROXBURGH...;Le chasseur de monstres Van Helsing est mandaté par le Vatican pour anéantir Dracula Une traque au démon à réserver uniquement aux amateurs de vampires et d'horreur;1.85 / Son 5.1 surround / LG : Eng, Fra / S-T : Eng pour sourds et malentendants, Fra / Comm. du réal.S.Sommers et du producteur, explorer le château de Dracula, bêtisier;FAN;127';2004-12-30;vanhelsing.jpg;0000-00-00;NULL
131;53780;MOMIE/SOMMERS (LA );1999;SOMMERS S.;Scé.S.SOMMERS, L.FONVIELLE,K.JARRE,mus.J.GOLDSMITH/ Int.B.FRASER/ R.WEISZ/ J.HANNAH...;"Interdit aux - de 12 ans
Une aventure où l'humour l'emporte sur tout, plus proche de Y a-t-il un aventurier dans la pyramide ? que de La momie de Freund Se laisse regarder avec plaisir";DVD 9 / 2.35 / LG : Fra, Eng, Spa, Ita / S-T : Fra, Ara + Eng pour malentendants / Making of, commentaires, scènes supplémentaires, effets spéciaux, bande-annonce;FAN;120';2004-12-30;momie.jpg;0000-00-00;NULL
132;22072;VOL AU-DESSUS D'UN NID DE COUCOU;1975;FORMAN M.;D'après K.KESEY, scé.L.HAUBEN, B.GOLDMAN/Int.J.NICHOLSON/ L.FLETCHER/ W.REDFIEL/ D.R.BROOKS;Un voyou se retrouve dans un centre psychiatrique où règne une infirmière despotique Satire corrosive dominée par le jeu survolté des acteurs;6/9 compatible 4/3 / LG : Fra, Eng, Ita / S-T : Fra, Eng, Ita, Nld, Spa, Por, Ara + Eng pour malentendants.;CDR;134';2004-12-30;volcoucou.jpg;0000-00-00;NULL
133;55735;NOM DE LA ROSE (Edition collector) (LE );1986;ANNAUD J.-J.;D'après U.ECO, scé.G.BRACH, A.BIRKIN, H.FRANKLIN,mus.J.HORNER/Int.S.CONNERY/ C.SLATER/ F.ABRAHAM...;En l'an 1327, un franciscain enquête sur des morts au sein d'une abbaye bénédictine Une reconstitution historique exigeante, une adaptation réussie de ce thriller moyenâgeux;DVD 9 / 1.85 / LG : Fra, Eng / S-T : Fra, Eng, Nld, Ara, Bul, Rum + Eng pour malentendants / Commentaire, documentaire L'abbaye du crime, analyse du film, du roman au film;HIS;131';2004-12-30;nomdelarosegrand.jpg;NULL;NULL
134;NULL;Léaud l'unique;2001;Le peron Serge;Divers;Portrait de Jean-Pierre Léaud qui évoque l'acteur au présent et revisite le mythe en interrogeant cinéastes, partenaires et compagnons de route.;Z2 - DVD 5 - PAL - film couleur - 4/3;MUS;59';2004-12-30;NULL;NULL;NULL
135;39803;VALLEE (LA );1972;SCHROEDER B.;Scé. B.SCHROEDER, dial.B.SCHROEDER,P.GEGAUFF,mus.PINK FLOYD/ Int.B.OGIER/ J.-P.KALFON/ M.GOTHARD;"Interdit moins de 13 ans
Une bourgeoise suit un groupe de hippies à la recherche d'une vallée mythique dans la brousse australienne Un style contemplatif et un rythme lent calqué sur l'époque hippie";Son dolby digital 5.1 / Bande-annonce, biographie, galeries de photos, court métrage : Le cochon aux patates douces.;CDR;130';2004-12-30;vallee.jpg;NULL;NULL
136;60044;BIG FISH;2003;BURTON T.;D'après D.WALLACE, scé. J.AUGUST,mus. D.ELFMAN, B. HOLLY/ Int. E.Mc GREGOR / A. FINNEY / B. CRUDUP/ J. LANGE...;Le récit fantastique des fabuleuses aventures vécues par un homme au seuil de sa vie Un film très personnel, un voyage homérique qui réveille l'enfant sommeillant en chaque adulte;DVD 9 / 1.85, 16/9 comp. 4/3 / 5.1 / LG : Fra, Eng, Tur / S-T : Fra, Eng, Tur, Nld, Ara / Commentaire audio, quiz, bandes-annonces, doc. (T.Burton le conteur, E.Bloom au cirque);FAN;125';2005-06-27;bigfish.jpg;0000-00-00;NULL
137;58991;BREAKING THE WAVES;1996;VON TRIER L.;TRIER /Int. E. WATSON/S.SKARSGARD/K. CARTLIDGE/J.-M. BARR/J. HACKETT;Une femme se sacrifie pour l'amour d'un homme Un impressionnant mélange de religion, d'érotisme et de possession (Grand Prix du jury Cannes 1996);DVD 9 + 5 / 2.35, 16/9 compatible 4/3 / 2.0 ou 5.1 / LG : Fra, Eng / S-T : Fra / Commentaire audio, scènes coupées commentées, clip promotionnel, interview;CDR;152';2005-06-27;breakingthewaves.jpg;0000-00-00;NULL
138;52596;LE DESSOUS DES CARTES : L'Europe, une alternative ?;2004;VICTOR J.-C.;-;"Les nouveaux entrants, L'empire se réformera-t-il ?, Un projet géographique, économique ou politique ?,
	

La Pologne, nouveau membre de l'Union, L'Europe des transports 1 et 2, Le FEDER, Une Europe hors d'Europe : Kaliningrad, La Turqui";DVD 9 / 4/3 / 2.0 / LG : Fra, Eng, Ger / Géopolitique des langues en Europe, chapitrage, les livres du Dessous des cartes.;DOC;10*6;2005-06-27;dessousdescarteseurope.jpg;0000-00-00;NULL
139;60826;HELLBOY;2003;DEL TORO G.;Scé. P. BRIGGS, G. DEL TORO, mus. M.BELTRAMI/ Int.R. PERLMAN/S. BLAIR/J. HURT...;Le diable Hellboy est caché et utilisé par le gouvernement américain pour lutter contre le mal Superhéros mélancolique, riche univers visuel, casting brillant Une vraie réussite;"Informations DVD non communiquées.
	";SFI;116';2005-06-27;hellboy.jpg;0000-00-00;NULL
140;34779;IN THE MOOD FOR LOVE;2000;WONG K.-W.;Scé. WONG KAR-WAI, mus.M. GALASSO/Int. M. CHEUNG/T. LEUNG;Chassé-croisé amoureux à Hong Kong dans les années 60 Chef-d'uvre de sensualité, de grâce, d'élégance, de charme, de séduction et une musique !;DVD 9 / 16/9 compatible 4/3 / LG : Fra, Chi (cantonais, mandarin) / S-T : Fra / Chapitrage, bande-annonce, notes sur la musique.;CDR;98';2005-06-27;inthemoodforlove.jpg;0000-00-00;NULL
141;60674;KIKI LA PETITE SORCIERE;1989;MIYAZAKI H.;D'après E. KADONO ,scé. H. MIYAZAKI,mus. J.HISAISHI;Flanquée de son balai et de son chat, Kiki, irrésistible petite sorcière, quitte le nid familial pour faire son apprentissage de par le monde Une animation splendide et lumineuse;1.85, 16/9 / Son 5.1 et 2.0 / LG : Eng, Jpn, Fra / S-T : Fra, Eng / Menu interactif, chapitrage.;ANI;102';2005-06-27;kiki.jpg;0000-00-00;NULL
142;59869;KILL BILL volume 2;2003;TARANTINO Q.;Scé. Q. TARANTINO, mus. RZA,R.RODRIGUEZ/Int.U. THURMAN/ D. CARRADINE/ M. MADSEN;Un film toujours saignant mais très différent du premier opus par son côté romanesque, sentimental et bavard Une conclusion savoureuse et élégante de cette saga époustouflante;Son 5.1 et DTS / LG : Fra, Eng / S-T : Fra + Fra pour malentendants / Making of, le groupe Chingon en concert à la première de Kill Bill 2, scène inédite, bandes-annonces, galerie photos;CDR;135';2005-06-27;killbill2.jpg;0000-00-00;NULL
143;56994;MASTER AND COMMANDER;2003;WEIR P.;P. O'BRIAN,scé. P. WEIR, J. COLLEE,mus. I.DAVIES,C.GORDON,R.TOGNETTI/Int. R. CROWE/P. BETTANY/E. WOODALL...;Une épopée maritime pendant les guerres napoléoniennes Une uvre à la fois spectaculaire et psychologique qui allie des combats impressionnants à la peinture dun univers clos;Informations DVD non communiquées;AVE;135';2005-06-27;masterandcommander.jpg;0000-00-00;NULL
144;58923;PIRATES DES CARAIBES;2002;VERBINSKI G.;Distr. BVHE - Scé. T.ELLIOTT, T. ROSSIO, mus.K.BADELT /Int.J. DEPP/G. RUSH/K. KNIGHTLEY...;Des effets visuels impressionnants, des décors spectaculaires, des dialogues truculents Et, au milieu de cette surenchère bien menée, Johnny Depp, acteur talentueux et irrésistible;Informations DVD non communiquées.;AVE;132';2005-06-27;piratedescaraibes.jpg;2013-02-07;COLO VARS
145;52409;TRIPLETTES DE BELLEVILLE (LES);2002;CHOMET S.;Scé. S. CHOMET,mus. B.CHAREST Avec les voix de J.-C. DONDA, M. ROBIN et M. VIEGAS;Plusieurs jours après avoir vu le film, vous fredonnerez encore le célèbre air des Triplettes, à tout bout de champ Ne vous inquiétez pas, c'est normal !;"DVD 1 : idem édition simple / DVD 2 : making of, (15') entretien avec Sylvain Chomet et Evgeny Tomov (chef déco.) (30'), Leçon d'animation de Sylvain Chomet
	";ANI;78';2005-06-27;lestriplettesdebelleville.jpg;0000-00-00;NULL
146;61458;UN LONG DIMANCHE DE FIANCAILLES;2004;JEUNET J.-P.;S. JAPRISOT, scé. G. LAURANT, J.-P. JEUNET,mus.A.BADALAMENTI/ Int. A. TAUTOU/ G. ULLIEL/ C. CORNILLAC...;1919, Mathilde enquête pour prouver à tous, et à elle-même, que son fiancé n'est pas mort sur le front Des images enluminées rassemblées dans cet album d'antan qui séduisent;DVD 9 / 2.35, 16/9 comp. 4/3 / 5.1 ou DTS + Audiovision Fra / LG : Fra / S-T : Fra pour malentendants, Eng / Commentaire audio, bande-annonce.;CDR;128';2005-06-27;unlongdimanche.jpg;0000-00-00;NULL
147;38486;USUAL SUSPECTS;1995;SINGER B.;Scé. C. Mc QUARRIE/Int. S.BALDWIN/G.BYRNE/B.DEL TORO/K.POLLAK/ K. SPACEY/ C. PALMINTERI/ S. AMIS;Cinq petits gangsters sont interrogés par la police pour un détournement d'armes Le second film d'un surdoué qui réalise le thriller de l'année;DVD 9 / 16/9 compatible 4/3 / Son 5.1 / LG : Fra, Eng / S-T : Fra, Eng, Nld / Comm. audio de John Ottman, Brian Synger et Christopher McQuarrie.;POL;108';2005-06-27;usualsuspect.jpg;0000-00-00;NULL
148;51600;CHATEAU DANS LE CIEL (LE );1986;MIYAZAKI H.;Distr. BVHE - Scé. H.MIYAZAKI, mus. J.HISAISHI, animation H. MIYAZAKI, T. NIWAUCHI, Y. KANEDA;Deux enfants intrépides sont en quête de Laputa, un royaume mythique perdu dans le ciel Un univers onirique d'une grande beauté visuelle Ce conte éblouissant est un petit bijou;"1.85, 16/9 / Son dolby digital 2.0 et 5.1 / LG : Fra, Jpn, Eng / S-T : Fra, Eng / Menu interactif, chapitrage.
			";ANI;120';2005-06-27;lechateaudansleciel.jpg;0000-00-00;NULL
149;56218;LOST IN TRANSLATION;2003;COPPOLA S.;Scé. S. COPPOLA, mus. K. SHIELDS, B. REITZELL,.AIR/Int.B.MURRAY/ S. JOHANSSON/ G. RIBISI/ A. TAKESHITA...;Tokyo, le duo mélancolique et drôle d'un acteur vieillissant et désabusé et d'une jeune femme délaissée par son mari Un film attachant sur le sentiment d'être étranger au monde;DVD 9 / 2.35, 16/9 / LG : Fra, Eng / S-T : Fra, Eng + Fra pour malentendants / Bande-annonce, conversation avec Bill Murray et Sofia Coppola, 5 scènes inédites;CDR;100';2005-06-27;lostintranslation.jpg;0000-00-00;NULL
150;36222;BAGDAD CAFE;1987;ADLON P.;Ed.MK2 - Scé.P. et E. ADLON,mus.B.TELSON, BACH/Int. M. SAGEBRECHT / CCH. POUNDER / J. PALANCE;Comment changer les lieux et les gens ? Naïveté, franchise, charme et fraîcheur sont les atouts de Marianne Sägebrecht dans ce film habité par la grâce;16/9 compatible 4/3 / LG : Fra, Eng / S-T : Fra / Musique du film, making of.;CDR; 91';2005-12-11;bagdadCafe.jpg;NULL;NULL
151;67447;BOB L'EPONGE - Eponge cherche travail;2002;Nickelodeon;NULL;"Prod.Nickelodeon - Huit nouvelles aventures de ce carré d'éponge, phénomène au box-office des tout-petits
	

Au Crabe Croustillant, restaurant réputé et tenu d'une pince de fer par Mr. Krabs, Bob n'a plus le temps de buller, entre un patron autoritair";DVD 9 / 1.33, 4/3 / Autres informations DVD non communiquées.;ANI;8x';2005-12-11;BobLeponge01.jpg;NULL;NULL
152;39105;BRIDGET JONES : JOURNAL DE BRIDGET JONES (LE );2001;MAGUIRE S.;D'après H.FIELDING, scé. A. DAVIS,R. CURTIS,H.FIELDING/Int.R. ZELLWEGER/ H.GRANT/ C.FIRTH;Une trentenaire, urbaine, active, très sentimentale, et ses hantises : grossir et rester célibataire Une adaptation du best-seller réussie quoique moins ironique;DVD 9 / 16/9 compatible 4/3 / Son 5.1 / LG : Fra, Eng / S-T : Fra + Fra pour malentendants / Making of, commentaire, filmographies, bandes-annonces, clips, interviews;COM;100';2005-12-11;bridgetJones01.jpg;NULL;NULL
153;63585;BRIDGET JONES : L'AGE 2 RAISON;2003;KIDRON B.;Scé. A. DAVIES, H. FIELDING,R. CURTIS,mus.H.GREGSON-WILLIAMS/Int.R. ZELLWEGER/H. GRANT/C. FIRTH...;Amoureuse de Mark Darcy, la touchante et grassouillette Bridget n'en a pas perdu pour autant ses angoisses chroniques de trentenaire Un divertissement sucré et pétillant !;DVD 9 / 16/9 comp. 4/3 / Son 5.1 et 2.0 / LG : Fra, Eng / S-T : Fra / Commentaire audio de Beeban Kidron.;COM;100';2005-12-11;bridgetJones02.jpg;NULL;NULL
154;56494;C'EST PAS SORCIER : Attention, planète fragile;2000;DIVERS;DIVERS;"Magazine de sciences et découverte présenté par Frédéric Courant, Jamy Gourmaud et Sabine Quindou
	

L'eau, ça coule de source, L'eau en danger, L'effet de serre et Les nouvelles énergies Quatre thématiques passionnantes pour comprendre et te";DVD 9 / 4/3 / Son mono / LG : Fra / S-T : Fra pour sourds et malentendants / Chapitrage par expérience, un quiz, une partie Rom proposant des sites à visiter.;DOC;105';2005-12-11;cpsPlaneteFragile.jpg;NULL;NULL
155;65319;C'EST PAS SORCIER : La médecine à votre santé !;2005;DIVERS;DIVERS;"Magazine de science et découverte présenté par Frédéric Courant, Jamy Gourmaud et Sabine Quindou
	

Quatre épisodes : Le secourisme : les gestes qui sauvent, L'anesthésie : vous pouvez dormir tranquille !, Les antibiotiques : les bactéries font d";DVD 9 / 1.33, 4/3 / Son mono / S-T : Fra pour sourds et malentendants / Chapitrage, quiz, aide à la navigation, carnet d'adresses, la collection C'est pas sorcier;DOC;105';2005-12-11;cpsMedecine.jpg;NULL;NULL
156;61656;CITE DES ENFANTS PERDUS (LA );1995;JEUNET J.-P.;Scé. G. ADRIEN,J.-P. JEUNET,M. CARO / Int. R. PERLMAN/D.EMILFORK/J.VITTET/D. PINON/J.-C. DREYFUS/G. BRUNET;Une île, peuplée de créatures monstrueuses, sert de repaire à un vieillard qui vole les rêves des enfants Un film à voir pour les décors et les costumes;DVD 9 / 16/9 compatible 4/ 3 / Son 2.0 DPL et 5.1 / LG : Fra / S-T : Fra pour sourds et malentendants / Commentaire audio de Jean-Pierre Jeunet (mai 2001).;FAN;112';2005-12-11;laCiteDesEnfantsPerdus.jpg;NULL;NULL
157;61326;VIPERE AU POING;2003;BROCA P.de;D'après H. BAZIN,scé.P. BROCA,O. VINCENT,mus.B. LOCK/Int.C. FROT/J. SITRUK/J. VILLERET...;Le règlement de comptes cruel d'Hervé Bazin avec sa mère, jugée par lui folle et cochonne, et surnommée Folcoche Une adaptation qui fait la part belle à C.Frot;DVD 9 / 2.35, 16/9 comp. 4/3 / Son 5.1/ LG : Fra / S-T : Fra pour malentendants / Bandes-annonces, Italiques spécial Hervé Bazin (extraits), hommage à P.de Broca.;CDR;100';2005-12-11;vipereaupoing.jpg;NULL;NULL
158;57361;MALABAR PRINCESS;2003;LEGRAND G.;Scé. G. LEGRAND,M.-A. MURAIL,P. VUAILLAT,mus.R.AUBRY/Int.J. VILLERET/M. LAROQUE/C. BRASSEUR...;Tom, dix ans, n'a qu'une idée : retrouver sa mère disparue sur un glacier du Mont-Blanc En pension chez son grand-père, il va faire ressurgir de nombreux secrets de famille;DVD 9 / 16/9 comp. 4/3 / Son 5.1 / LG : Fra / S-T : Flamand, Eng + Fra pour sourds et malentendants / Documentaire, making of Le petit Malabar, scènes coupées, photos;CDR;91';2005-12-11;malabar.jpg;NULL;NULL
159;30801;CONTACTS - vol.1 : la grande tradition du photo-reportage;1988;DIVERS;DIVERS;"KS Vision / Sur une idée de W.Klein - 12 photographes commentent leurs planches contact et tirages d'essais :
	

William Klein, H.Cartier-Bresson, R.Depardon, Joseph Koudelka, R.Doisneau, E.Boubat, Elliot Erwitt, M.Riboud, H.Newton, Don McCullin, Leona";DVD 9 / Standard NTSC / 4/3 / Son dolby digital mono / LG : Fra, Eng.;DOC;156';2005-12-11;contacts.jpg;0000-00-00;NULL
160;57770;DUEL;1971;SPIELBERG S.;D'après R. MATHESON/Int.D. WEAVER/ L. BENSON/J. SCOTT/E. FIRESTONE/L. FRIZELL;Un représentant de commerce roulant tranquillement sur une route californienne se trouve bloqué derrière un camion Premier Spielberg, grand prix au premier festival d'Avoriaz;DVD 9 / 1.33, 4/3 / LG : Fra, Eng / S-T : Fra, Eng / Les coulisses du film comment.par S.Spielberg, l'écriture du scénario par R.Matheson, galerie photos, bandes-annonces.;SFI;88';2005-12-11;duel.jpg;NULL;NULL
161;36225;FORREST GUMP;1994;ZEMECKIS R.;D'après W. GROOM,scé.E. ROTH,eff.spéc.Industrial Light & Magic/Int.T. HANKS/S .FIELD/R. WRIGHT/G. SINISE;Trente ans de l'histoire des Etats-Unis revue et corrigée par un candide Un festival d'effets spéciaux, des moments drôles, parfois acides;LG : Fra, Eng / S-T : Fra, Eng / Bandes-annonces, commentaires, photos, documentaires, making of.;SFI;140';2005-12-11;forrestGump.jpg;NULL;NULL
162;33093;GOUT DES AUTRES (LE );2000;JAOUI A.;Scé.A. JAOUI,J.-P. BACRI/Int.A. JAOUI/J.-P. BACRI/A. ALVARO/G. LANVIN/C. MILLET;Ces deux-là n'ont pas leur pareil pour croquer les défauts de notre société et nous faire rire avec eux de nous-mêmes Quant à la réalisation, un premier film sans fautes;16/9 compatible 4/3 / LG : Fra / S-T : Eng / Fra pour malentendants / Interview d'Agnès Jaoui, filmographies, images du tournage, bande-annonce.;CDR;112';2005-12-11;goutDesAutres.jpg;NULL;NULL
