276;25180;KIRIKOU ET LA SORCIERE;1998;OCELOT M.;Scé. M. OCELOT, déc. M. OCELOT ,T . MILLION , mus. Y N'DOUR (Grand Prix du long métrage, Annecy 1999).;Kirikou s'enfante tout seul pour aller combattre au plus vite la sorcière Karaka qui a jeté un sort à sa tribu Un conte délicieux servi par une très belle animation, on en redemande;DVD 5 / 4/3 / LG : Fra / S-T : Fra pour sourds et malentendants / Chapitrage, chansons, notes de production, interviews du réalisateur, fiche technique.;ANI;70';2007-01-27;kirikouEtLaSorciere.jpg;0000-00-00;NULL
277;76444;KIRIKOU ET LES BETES SAUVAGES;2005;OCELOT M./ GALUP B.;Scé.M. OCELOT,mus.Y. N'DOUR,R. TRAORE,M.DIBANGO,anim.O. REYNAL,S. CARTRO, A. DARTIGE;Pour à nouveau défendre son village contre Karaba, Kirikou devient tour à tour jardinier, détective, potier, marchand et médecin Toujours intelligent et subtil en plus d'être beau, quel retour !;"DVD 9 (inrayable, protection macrovision) 1.77, 16/9 anamorphique 4/3 / Audiovision sur le film uniquement / LG : Fra / S-T : Fra pour sourds et malentendants / Bandes-annonces...
	
	";ANI;75';2007-01-27;kirikouEtLesBetesSauvages.jpg;0000-00-00;NULL
278;85319;NAUSICAÄ DE LA VALLEE DU VENT;1984;MIYAZAKI;Distr. BVHE - Scé. H.  MIYAZAKI, mus. J. HISAICHI;"Sur une terre ravagée par la folie des hommes durant les sept jours de feu, une poignée d'humains a survécu.
Menacée par une forêt toxique qui ne cesse de prendre de l'ampleur, cette poignée de survivants attend le salut de la princesse Nausicaä, capable";" 1 DVD-9 / 16/9 / Dolby Digital 2.0 / LG : Fre, Jpn / S-T : Fre / Menu interactif, chapitrage.
	";ANI;111';2007-07-01;cov_8717418074579.jpg;NULL;NULL
279;85937;AZUR ET ASMAR;2004;OCELOT M.;NULL;"Il y a bien longtemps, deux enfants étaient bercés par la même femme. Azur, blond aux yeux bleus, fils du châtelain, et Asmar, brun aux yeux noirs, fils de la nourrice. Elevés comme deux frères, les enfants sont séparés brutalement.
Mais Azur, marqué par";1 DVD-9 / 1.85:1 / 16/9 comp. 4/3 / Dolby Digital 2.0, Dolby Digital 5.1, DTS 5.1 / LG : Fre / S-T : Fre / Audiovision DTS 5.1 / Portrait de Michel Ocelot (26'), karaoké, bandes-annonces.;ANI;99';2007-07-01;cov_3384442115674.jpg;NULL;NULL
280;68575;POUPEES RUSSES (LES );2004;KLAPISCH C.;Scé. C.KLAPISCH/Int. R.DURIS/ C.deFRANCE/ K.REILLY/ K.BISHOP/ A.TAUTOU...;Cinq ans après l'Auberge espagnole, Klapisch retrouve ses héros Le résultat est chaleureux, dynamique, émouvant, empreint de mélancolie, plein de fantaisie Bref, c'est réussi !;DVD 9 / 16/9 comp. 4/3 / Son DTS, 5.1, 2.0 / LG : Fra / S-T : Fra / Aucun bonus.;CDR;125';2007-07-01;cov_3259130228328.jpg;NULL;NULL
281;84528;JE VAIS BIEN, NE T'EN FAIS PAS;2005;LIORET P.;D'après O.ADAM, scé. O.ADAM, P.LIORET,mus.N.PIOVANI/ Int.M.LAURENT/ J.BOISSELIER/ K.MERAD...;Rentrée de vacances, Lili, 19 ans, apprend que son jumeau a disparu Pour elle, tout s'écroule Un drame familial sobre et délicat, le portrait subtil et tout en émotion d'une jeune fille d'aujourd'hui;1 DVD-9 / 2,35:1 / 16/9 comp. 4/3 / Dolby Digital 2.0, Dolby Digital 5.1 / LG : Fre / S-T : Eng / + Fre pour sourds et malentendants / Commentaire audio de Philippe Lioret et du producteur, making of,;CDR;100';2007-07-01;cov_3259130234145.jpg;NULL;NULL
282;84190;VENT SE LEVE (LE );2005;LOACH K.;Scé. P.LAVERTY,mus. G.FENTON/ Int. C.MURPHY/P.DELANEY/L.CUNNINGHAM/O.FITZGERALD/ M.O'RIORDAN/ G.KEARNEY...;Irlande, 1920. Des paysans s'unissent pour former une armée de volontaires contre les redoutables Black and Tans, troupes anglaises envoyées par bateaux entiers pour mater les velléités d'indépendance du peuple irlandais.Par sens du devoir et amour de son;1 DVD-9 / 1.85:1 / 16/9 comp. 4/3 / LG : Eng, Fre / S-T : Fre, Eng / Chapitrage, filmographie, bandes-annonces.;CDR;124';2007-07-01;cov_3384442117074.jpg;NULL;NULL
283;91598;LE SECRET DES POIGNARDS VOLANTS;2003;ZHANG Y.;Scé.Y.ZHANG,LI FENG,B.WANG,mus.S.UMEBAYASHI/ Int. T.KANESHIRO/ A.LAU/ Z.ZHANG...;859, en Chine, ravagée par les conflits, la dynastie Tang est sur le déclin, menacée par des rebelles dont le plus puissant est la Maison des poignards volants;DVD 9 / 2.35, 16/9 compatible 4/3 / 5.1, 5.1 DTS / LG : Fra, Chi (mandarin) / S-T : Fra / Eng pour sourds et malentendants.;AVE;114';2007-07-01;3687860438.jpg;NULL;NULL
284;83400;PIRATES DES CARAIBES : T02 - Le secret du coffre maudit;2006;VERBINSKI G.;Distr.BVHE - Scé.T.ELLIOT, T.ROSSIO,mus.H.ZIMMER/ Int.J.DEPP/ K.KNIGHTLEY/ O.BLOOM...;Le retour de Jack Sparrow, dans une suite enlevée aux aventures décoiffantes et distrayantes De nombreuses trouvailles visuelles, de l'humour et un Johnny Depp toujours épatant;2.35, 16/9 / Son DTS et 5.1 / LG : Fra, Eng / S-T : Fra, Eng, Nld / Menu interactif, chapitrage.;AVE;144';2007-07-01;cov_8717418110147.jpg;NULL;NULL
285;41359;STAR WARS : II - L'attaque des clones;2002;LUCAS G.;Scé. G.LUCAS, J.HALES, mus.J.WILLIAMS/Int.E.McGREGOR/ N.PORTMAN/ H.CHRISTENSEN/ C.LEE;Le bestiaire s'agrandit à l'aune de la galaxie mais trop d'effets spéciaux tuent le récit et le cinéma, les étoiles pâlissent et la saga perd de son charme malgré des morceaux de bravoure;"2 DVD 9 / 16/9 compatible 4/3 / Son dolby digital 5.1 EX / LG : Fra, Eng.
";SFI;132';2007-07-01;cov_3344428009458.jpg;NULL;NULL
286;67877;STAR WARS : III - La revanche des Sith;2004;LUCAS G.;Scé. G.LUCAS, mus.J.WILLIAMS/ Int.H.CHRISTENSEN/E. McGREGOR/ N.PORTMAN/ I.McDIARMID..;Comment Anakin Skywalker, jeune chevalier Jedi, tenté par le côté obscur de la Force, prête allégeance au maléfique Darth Sidious et devient Dark Vador Apre et ténébreux épisode;"Informations DVD non communiquées.
	";SFI;180';2007-07-01;cov_3344428019235.jpg;NULL;NULL
287;91591;OUT OF AFRICA;1986;POLLACK S.;D'après K.BLIXEN, scé.K.LUEDTKE, mus.J.BARRY/Int.R.REDFORD/ M.STREEP/ K.M.BRANDAUER...;Un cinéma nostalgique et romantique, inspiré de l'autobiographie de Karen Blixen et des dix-neuf années passées au Kenya Du grand spectacle !;"1 DVD-9 / 1.85:1 / 16/9 comp. 4/3 / DD 2.0 et 4.0 / LG : Ita, Fre, Eng / S-T : Fin, Eng, Bul, Dan, Fre, Hun, Dut, Nor, Pol, Por, Swe, Cze, Tur / Notes de production, filmographies
	";CDR;154';2007-07-01;cov_3333297901192.jpg;NULL;NULL
288;29448;LA LIGNE ROUGE;1999;MALICK T.;J.JONES, scé.T.MALICK/ Int.J.CAVIEZEL/S.PENN/N.NOLTE/E.KOTEAS/ A.BRODY/ G.CLOONEY/ W.HARRELSON;Un paradis sur terre, Guadalcanal, devient le théâtre d'une des grandes boucheries de la seconde guerre mondiale Un film de guerre lyrique et inhabituel, tout en finesse et retenue;6/9 compatible 4/3 / LG : Fra, Eng, Ita / S-T : Fra, Eng, Ita, Nld, Gre / Bande-annonce, chants mélanésiens.;HIS;170';2007-07-01;cov_8712626000334.jpg;NULL;NULL
289;49686;LE DESSOUS DES CARTES : Une planète en sursis;2003;VICTOR J.-C.;NULL;"Ce DVD comprend :
 Déforestation : le cas de la forêt amazonienne
 Désertification
 Pollution des mers
 Le Grand Nord agressé
 Entretien avec Aqqaluk Lynge
 Golfe de Guinée : pétrole ou écotourisme ?
 Leau et les mégapoles aujourdhui
";DVD 9 / 4/3 / 2.0 / LG : Fra / La tectonique des plaques, chapitrage détaillé pour une approche pédagogique de chaque émission, bibliographie.;DOC;12x10';2007-07-01;21ZMMSC42XL.jpg;NULL;NULL
290;60851;LE DESSOUS DES CARTES : Etats-Unis, une géographie impériale;2004;J.-C.VICTOR;NULL;"Ed.ARTE Vidéo - Etudes de géopolitique de J.-C.VICTOR 80 cartes pour comprendre la puissance américaine
	La formation du territoire américain, 20e siècle : l'émergence de la puissance internationale américaine, La politique étrangère depuis le 11";DVD 9 / 16/9 comp. 4/3 / Dolby 2.0 / LG : Fra, Eng / Chapitrage, Les dessous du Dessous des cartes : retour sur les principes d'une méthode d'analyse;DOC;12x10';2007-07-01;51CGH5VSF0L._AA240_.jpg;NULL;NULL
291;86078;SLEEPY HOLLOW;2000;BURTON T.;D'après W.IRVING, scé.A.K.WALKER, mus.D.ELFMAN/Int.J.DEPP/ C.RICCI/ M.RICHARDSON/ M.GAMBON;1799, un policier arrive en Nouvelle-Angleterre pour démasquer un cavalier sans tête semant le carnage Conte gothique plastiquement superbe;"1 DVD-9 / 1.85:1 / 16/9 comp. 4/3 / Dolby Digital 5.1 / LG : Eng, Fre / S-T : Fre / Making of (30'), document avant Tim Burton, interviews de T.Burton et J.Depp, 6 filmographies
	";FAN;105';2007-07-01;cov_3259130234466.jpg;NULL;NULL
292;76585;LES BRONZES : 3 - Amis pour la vie;2005;LECONTE P.;Scé. T.LHERMITTE, J.BALASKO, M.BLANC,mus.E.PERRUCHON,ZUCCHERRO/ Int. J.BALASKO/ T.LHERMITTE/ M.BLANC...;Vingt-sept ans après avoir fait du ski ensemble, goûté la fondue savoyarde et l'alcool de crapaud, les Bronzés sont toujours amis et se rendent en Côte d'Ivoire N'allez pas bouder votre plaisir !;DVD 9 / 16/9 comp. 4/3 / Son 2.0 et 5.1 / LG : Fra.;COM;97';2007-07-01;cov_3259130228366.jpg;NULL;NULL
293;90434;CARS;2005;LASSETER J.;Distr.BVHE - Scé. J.LASSETER, D.FOGELMAN, D.GERSON, mus.R.NEWMAN;Flash McQueen, une splendide voiture de course toute neuve promise au succès, découvre que dans la vie, ce n'est pas de franchir la ligne d'arrivée qui compte, mais le parcours que l'on a suivi. Parti pour participer à la prestigieuse Piston Cup, il atter;1 DVD-9 / LG : Eng, Fre / S-T : Fre, Eng.;ANI;96';2007-07-01;cov_8717418074722.jpg;NULL;NULL
294;84532;LITTLE MISS SUNSHINE;2005;DAYTON J. / FARIS  V.;Scé. M. ARNDT, mus. M.DANNA/ Int. G.KINNEAR/ T.COLLETTE/ S.CARELL...;Road-movie initiatique en compagnie d'une famille américaine Un voyage à la fois tendre et cruel et plein de vitalité, véritable thérapie de groupe Le coup de cur du public de l'année 2006 !;Informations DVD non communiquées.;CDR;100';2007-07-01;31T0WqDGc8L._AA225_.jpg;0000-00-00;NULL
295;90957;A LA RECHERCHE DU BONHEUR;2006;MUCCINO G.;Scé. S.CONRAD, mus. A.GUERRA/ Int.W.SMITH/T.NEWTON/J.SMITH/ D.CASTELLANETA/ B.HOWE/ A.DEL RIO...;Portrait de Chris Gardner, employé précaire d'une firme de courtage qui se retrouve à la rue avec son fils de cinq ans L'histoire d'une success-story douce-amère à la poursuite du rêve américain;1 DVD-9 / 2,35:1 / 16/9 comp. 4/3 / Dolby Digital 5.1 / LG : Eng, Fre / S-T : Fre, Eng / Commentaire audio de Gabriele Muccino, Une vision italienne du rêve américain, le Rubik's Cube;CDR;118';2008-01-27;aLaRecherche.jpg;NULL;NULL
296;90333;SERPENT (LE );2006;BARBIER E.;D'après T.LEWIS, scé.E.BARBIER, N.TRAN-MINH,mus.R.BARBIER/Int. C.CORNILLAC /Y.ATTAL/ P.RICHARD...;La descente aux enfers d'un photographe qui voit sa vie s'effondrer à cause d'une manipulation orchestrée par un ancien camarade de classe Meurtre, sexe et chantage, les ingrédients d'un bon thriller;1 DVD-9 + 1 DVD-5 / 1.85:1 / 16/9 comp. 4/3 / Dolby Digital 5.1, DTS 5.1, THX / LG : Fre + Fre pour malentendants / Making of (26'), entretiens avec Eric Barbier, Yvan Attal, Clovis Cornillac et Pierr;CDR;119';2008-01-27;leSerpent.jpg;NULL;NULL
297;77750;VIE EST BELLE / L'HOMME DE LA RUE (LA );1941;CAPRA F.;J.STEWART/ D.REED/ H.TRAVERS G.COOPER/E.ARNOLD...;"Coll.Ciné club / DVD 1 : La vie est belle (1946, 129') Int.J.STEWART/D.REED/H.TRAVERS... ;
DVD 2 : L'homme de la rue (1941, 135') Int.G.COOPER/E.ARNOLD... (Voir détails aux titres.)
2 DVD 5 / 1.33, 4/3 / 2.0 mono / LG : Eng / S-T : Fra.";NULL;CDR;129'/135';2008-01-27;laVieEstBelle.jpg;NULL;NULL
298;66114;MILLION DOLLAR BABY;2004;EASTWOOD C.;F.TOOLE,scé.P.HAGGIS,mus.C.EASTWOOD/Int. C.EASTWOOD/ M.FREEMAN/ H.SWANK...;La rencontre bouleversante entre une jeune boxeuse et un entraîneur solitaire et fatigué Une mise en scène parfaite, sobre et précise, et trois acteurs magistraux De l'émotion pure !;2.35 / 16/9 comp. 4/3 / Son 5.1 et DTS / LG : Fra, Eng / S-T : Fra.;CDR;130';2008-01-27;millionDollar.jpg;NULL;NULL
299;97688;PERSEPOLIS;2007;DIVERS;M.SATRAPI,scé.M.SATRAPI,V.PARONNAUD,mus.O.BERNET;De Téhéran en 1978 à Paris de nos jours, les heurs et malheurs de Marjane, jeune exilée iranienne Adaptation réussie de la bande dessinée éponyme Premier film drôle, inventif et militant;1 DVD-9 / 1.85:1 / 16/9 comp. 4/3 / Dolby Digital 2.0, Dolby Digital 5.1 / LG : Fre / S-T : Fre pour sourds et malentendants / La face cachée de Persepolis : making of (34'), scène coupée commentée;ANI;95';2008-01-27;persepolis.jpg;NULL;NULL
300;90751;BLOOD DIAMOND;2006;ZWICK E.;C.LEAVITT, scé. C.LEAVITT, .G.MITCHELL, mus.J.N.HOWARD/Int.L.DI CAPRIO/ J.CONNELLY/ D.HOUNSOU/ A.VOSLOO...;Un film d'aventure engagé réussi qui pointe du doigt le rôle controversé des Occidentaux dans le trafic des diamants servant à financer la guerre dans certains pays d'Afrique;1 DVD-9 / 16/9 comp. 4/3 / Dolby Digital 5.1 / LG : Eng, Fre / S-T : Eng, Fre / Commentaire du réalisateur, bande-annonce.;AVE;142';2008-01-27;bloodDiamond.jpg;NULL;NULL
301;96831;CONTRE-ENQUETE;2006;MANCUSO F.;L.BLOCK,scé.F.MANCUSO,mus.K.LEVY/Int. J.DUJARDIN/ L.LUCAS/A .BLANCHOT...;A la mort de sa fille, sauvagement assassinée, un capitaine de police ne croit pas à la culpabilité de l'homme incarcéré Convaincu que le meurtrier est un tueur en série, il décide de le traquer;2 DVD-9 / 1.85:1 / 16/9 comp. 4/3 / Dolby Digital 2.0, Dolby Digital 5.1 / LG : Fre / Commentaire audio du réalisateur Franck Mancuso,Dans les yeux d'un flic : reportage sur la préparation du film;POL;85';2008-01-27;contreEnquete.jpg;NULL;NULL
302;85719;UNE VERITE QUI DERANGE;2006; GUGGENHEIM D.;DIVERS;"Quelles pourraient être les conséquences d'un dérèglement majeur du système climatique ? L'ancien vice-président démocrate
	

Al Gore déroule un cours magistral implacable, clair, étayé et chiffré de ce qui nous attend si rien n'est fait pour freiner l";1 DVD / 1.78 / Dolby Digital 5.1 / LG : Fre, Eng / S-T : Eng, Fre, Dut / Commentaire du réalisateur et des producteurs (VOST Eng et Fre), Une mise à jour de l'ex-vice-président Al Gore;DOC;93';2008-01-27;uneVerite.jpg;NULL;NULL
303;70582;FORESTI Florence - Fait ses sketches à la Cigale;2005;NON DETERMINE;FORESTI Florence;"Spectacle enregistré à la Cigale, Paris
	Avec ses airs de garçonne et son autodérision assumée, Florence Foresti s'attaque à nos défauts et aux futilités du quotidien Tonus, humour et générosité";DVD 9 / Son dolby digital 2.0 et 5.1 / LG : Fra / Le meilleur de On a tout essayé, les petits râteaux de Flo (Montréal 2004/2005), les coulisses du spectacle;COM;90';2008-01-27;foresti.jpg;NULL;NULL
304;78227;MEMOIRES D'UNE GEISHA;2004;MARSHALL R.;A.GOLDEN, scé.R.SWICORD, D.WRIGHT,mus.J.WILLIAMS/ Int.J.LOEB III/ L.GONG/ M.YEOH...;La vie de la légendaire geisha Sayuri Un film purement romanesque où se côtoie la fine fleur des actrices asiatiques, des décors et des costumes superbes et une belle image;DVD 9 / 1.85, 16/9 comp. 4/3 / Son 5.1 et 2.0 / LG : Fra, Eng / S-T : Fra / Commentaires audios.;CDR;140';2008-01-27;geisha.jpg;NULL;NULL
305;68396;CIEL PEUT ATTENDRE  (LE );1943;LUBITSCH E.;L.BUSH-FEKETE, scé.S.RAPHAELSON, mus.A.NEWMAN/Int.D.AMECHE/ G.TIERNEY/ C.COBURN/ L.CALHERN...;Une fois mort, un joyeux noceur se présente à la porte de l'enfer Entre cynisme et raffinement, l'art de Lubitsch à son apogée, un chef-d'uvre;Une fois mort, un joyeux noceur se présente à la porte de l'enfer Entre cynisme et raffinement, l'art de Lubitsch à son apogée, un chef-d'uvre;CDR;112';2008-01-27;leCielPeut.jpg;NULL;NULL
306;93888;SEMOUN Elie - Se prend pour qui ?;2005;NON DETERMINE;Elie Semoun, Muriel Robin et Franck Dubosc;Le nouveau one man show d'Elie Semoun, où il se prend, tour à tour, pour un ado, un voisin, un homosexuel, un vieux, une vendeuse, un père célibataire, une racaille, un sourd...;Le nouveau one man show d'Elie Semoun, où il se prend, tour à tour, pour un ado, un voisin, un homosexuel, un vieux, une vendeuse, un père célibataire, une racaille, un sourd...;COM;120';2008-01-27;elieSemoun.jpg;NULL;NULL
307;50840;CUR DES HOMMES  (LE );2003;ESPOSITO M.;M. ESPOSITO,mus. B.THIRIET/Int. G.DARMON/J.-P.DARROUSSIN/ B.CAMPAN/ M.LAVOINE/ L.MIKAEL/ F.BABE;Quatre amis quinquagénaires témoignent de leurs rapports aux femmes et à l'amour Un premier film, véritable ôde à l'amitié, drôle, tendre, pudique et généreuse;DVD 5 et 9 / 2.35, 16/9 comp. 4/3 / LG : Fra / S-T : aucun / Making of, plans séquences non montés, exercices de lecture, bande-annonce, entretien avec le réalisateur.;CDR;105';2008-01-27;leCoeurDesHommes.jpg;NULL;NULL
308;85650;INDIGENES;2005;BOUCHAREB R.;Scé. R.BOUCHAREB,  O.LORELLE,mus.KHALED,A.AMAR,dial.R.BOUCHAREB,O.LORELLE/ Int.J.DEBBOUZE/S.NACERI/R.ZEM...;1943, quatre indigènes de l'armée d'Afrique sont envoyés en France, en première ligne Une page d'histoire oubliée, une noble cause défendue avec efficacité et saluée par un beau succès populaire;1 DVD-9 / 2,35:1 / 16/9 comp. 4/3 / Dolby Digital 5.1 / LG : Fre / S-T : aucun.;HIS;128';2008-01-27;indigene.jpg;NULL;NULL
309;87876;BLACK BOOK;2005;VERHOEVEN P.;Scé. P.VERHOEVEN (1938), G.SOETEMAN,mus.A.DUDLEY/Int. C. VAN HOUTEN/ S.KOCH/ T.HOFFMAN..;Une chanteuse, Rachel Stein, rejoint la Résistance, après avoir échappé à un massacre Un récit d'aventures historiques d'une belle virtuosité signe le retour du maître chez lui Une réussite;1 DVD-9 / 2,35:1 / 16/9 comp. 4/3 / DTS 5.1 / LG : Dut / S-T : Fre.;HIS;145';2008-01-27;blackBook.jpg;NULL;NULL
310;90635;ARTHUR ET LES MINIMOYS;2006;BESSON L.;D'après P. GARCIA,scé. L.BESSON, C.GARCIA,mus.E.SERRA/Int.M. FARROW/F. HIGHMORE/  P. BALFOUR...;Arthur est fasciné par les histoires que lui raconte sa gransd-mère, le soir Et si les Minimoys existaient ? Et si un trésor était caché dans le jardin de la maison ? Prouesse technique, trouvailles, plaisir;"1 DVD-9 / 2,35:1 / 16/9 comp. 4/3 / Dolby Digital 2.0, Dolby Digital 5.1 / LG : Eng, Fre / S-T : Fre + Fre pour sourds et malentendants / Making of : le monde magique d'Arthur (26')
	";ANI;103';2008-01-27;arthur.jpg;NULL;NULL
311;54534;LE DECLIN DE L'EMPIRE AMERICAIN / INVASIONS BARBARES;1985;ARCAND D.;P. AVIAT/ Int.R. GIRARD/ S.  ROUSSEAU/ D. BERRYMAN/ L. PORTAL...;"
Quatre hommes et quatre femmes, intellectuels québécois, parlent d'amour, de sexe, du quotidien Une comédie qui a fait date, un bavardage jubilatoire mâtiné d'un humour acerbe

Un homme, atteint d'un cancer et se sentant mourir, appelle à son chevet";"DVD 9 / 16/9 / LG : Fra / S-T : aucun.

";CDR;96' /  95';2008-01-27;empire.jpg;NULL;NULL
312;89612;LES INFILTRES;2006;SCORSESE M.;Scé.W. MONAHAN, mus. H. SHORE/ Int. L.DI CAPRIO/M.DAMON/J.NICHOLSON/ M. WAHLBERG/ M. SHEEN/ A. ANDERSON...;Pour mettre fin au règne d'un parrain de Boston, la police infiltre son gang Remake du déjà remarquable Infernal affairs, un jeu de masques au souffle épique qui fouille les méandres de l'identité;Pour mettre fin au règne d'un parrain de Boston, la police infiltre son gang Remake du déjà remarquable Infernal affairs, un jeu de masques au souffle épique qui fouille les méandres de l'identité;POL;150';2008-01-27;infiltres.jpg;NULL;NULL
313;29249;MEMPHIS BELLE;1990;CATON-JONES M.;Scé. M. MERRICK, mus.G. FENTON/ Int. M. MODINE/E.STOLTZ/ T. DONOVAN/ H. CONNICK Jr/ B. ZANE;1943. Une forteresse volante effectue son dernier raid sur l'Allemagne Film de guerre à la facture classique, presque documentaire par moment, virilité, prouesses et sentiments;"DVD 10 / 1.85 / LG : Fra, Eng, Ita / S-T : Fra, Eng, Ita, Nld, Ara, Spa, Por, Ger + Eng, Ita pour malentendants / Bande-annonce.
	";HIS;103';2008-01-27;memphis.jpg;NULL;NULL
314;"91856
";LA MOME;2006;"DAHAN O.
";Scé. O.DAHAN, mus. C.GUNNING/ Int. M. COTILLARD/J.-P.MARTINS/G.DEPARDIEU/ C. COURAU/ J.-P.  ROUVE/ S. TESTUD...;Magnifique portrait d'Edith Piaf, artiste à la fois populaire et universelle Un film qui résonne au rythme d'une biographie tragique, transcendé par une interprétation hors norme Une belle réussite;2 DVD-9 / 2,35:1 / 16/9 comp. 4/3 / Dolby Digital 2.0, 5.1, DTS 5.1 / LG : Fre / Audiovision (pour malvoyants) Dolby Digital 2.0. DVD 2, making of (26'), 3 scènes coupées commentées par O.Dahan, suivi;CDR;140';2008-01-27;laMome.jpg;NULL;NULL
315;90104;HORS DE PRIX;2006;SALVADORI P.;Scé. B. GRAFFIN, P. SALVADORI, mus. C. BAZBAZ,dial.P.SALVADORI/Int .A. TAUTOU/ G. ELMALEH/M.-C.  ADAM;Pour conquérir une aventurière, le serveur d'un grand hôtel se fait passer pour un milliardaire Une comédie à la fois sentimentale, malicieuse, grave et cruelle, un clin d'il aux maîtres américains;1 DVD-9 / 2,35:1 / 16/9 comp. 4/3 / Dolby SRD 5.1, DTS 5.1 / LG : Fre.;CDR;103';2008-01-27;horsDePrix.jpg;NULL;NULL
316;93543;DESPERATE HOUSEWIVES : (Saison 2) Ep 01-04;2005;DIVERS;M. CHERRY, C. PRATT,scé. M. CHERRY,mus.D.ELFMAN/ Int. M. CROSS/ E. LONGORIA/ T. HATCHER...;Quatre épisodes : Le retour de la mamie, Donne l'oseille et tire-toi, Massacre à la débroussailleuse, George fait de la résistance.;"1 DVD-9 / 16/9 comp. 4/3 / Dolby Digital 5.1 / LG : Eng, Fre / S-T : Fre.
	";COM;168';2008-01-27;desperate.jpg;NULL;NULL
317;92768;DESPERATE HOUSEWIVES : (Saison 2) Ep 05-04;2005;DIVERS;M. CHERRY, C. PRATT,scé. M. CHERRY,mus.D.ELFMAN/ Int. M. CROSS/ E. LONGORIA/ T. HATCHER...;Quatre épisodes : On n'enterre que deux fois, Not in the mood for love, Sexe, voisins et vidéo, L'ex-femme de ma vie.;1 DVD-9 / 16/9 comp. 4/3 / Dolby Digital 5.1 / LG : Eng, Fre / S-T : Fre.;COM;168';2008-01-27;desperate.jpg;NULL;NULL
318;85518;DESPERATE HOUSEWIVES : (Saison 2) Ep 09-12;2005;DIVERS;M. CHERRY, C. PRATT,scé. M. CHERRY,mus.D.ELFMAN/ Int. M. CROSS/ E. LONGORIA/ T. HATCHER...;Quatre épisodes : La nonne, la brune et l'ex-truand, Mon père, ce tordu, Bon baiser de Gaby, Médicalement vôtre.;1 DVD-9 / 16/9 comp. 4/3 / Dolby Digital 5.1 / LG : Eng, Fre / S-T : Fre.;COM;168';2008-01-27;desperate.jpg;NULL;NULL
319;92770;DESPERATE HOUSEWIVES : (Saison 2) Ep 13-16;2005;DIVERS;M. CHERRY, C. PRATT,scé. M. CHERRY,mus.D.ELFMAN/ Int. M. CROSS/ E. LONGORIA/ T. HATCHER...;Quatre épisodes : Deux filles amies-ennemies, Un petit jeu plein de conséquences, Va boire un p'tit coup à la maison, Opère-moi si tu peux.;1 DVD-9 / 16/9 comp. 4/3 / Dolby Digital 5.1 / LG : Eng, Fre / S-T : Fre.;COM;168';2008-01-27;desperate.jpg;NULL;NULL
320;92771;DESPERATE HOUSEWIVES : (Saison 2) Ep 17-20;2005;DIVERS;M. CHERRY, C. PRATT,scé. M. CHERRY,mus.D.ELFMAN/ Int. M. CROSS/ E. LONGORIA/ T. HATCHER...;Quatre épisodes : Un fauteuil pour trois, Autant en emporte le vin, Je l'aime à mentir, Courage, fuyez.;1 DVD-9 / 16/9 comp. 4/3 / Dolby Digital 5.1 / LG : Eng, Fre / S-T : Fre.;COM;168';2008-01-27;desperate.jpg;NULL;NULL
321;92772;DESPERATE HOUSEWIVES : (Saison 2) Ep 21-24;2005;DIVERS;M. CHERRY, C. PRATT,scé. M. CHERRY,mus.D.ELFMAN/ Int. M. CROSS/ E. LONGORIA/ T. HATCHER...;Quatre épisodes : Allumer les feux, Le cercle des voisins disparus, Les tourbillons de la vie - 1re partie, Les tourbillons de la vie - 2e partie.;"1 DVD-9 / 16/9 comp. 4/3 / Dolby Digital 5.1 / LG : Eng, Fre / S-T : Fre.
	";COM;168';2008-01-27;desperate.jpg;NULL;NULL
322;61979;36, QUAI DES ORFEVRES;2004;MARCHAL O.;Scé.O.MARCHAL,J.  RAPPENEAU,mus. A.RENOIR,E.KERMORVANT/Int.D.AUTEUIL/ G. DEPARDIEU/ A. DUSSOLLIER/ R. ZEM...;Une lutte ouverte oppose deux chefs de brigade briguant le poste de grand patron du 36, quai des Orfèvres Un vrai spectacle à l'américaine, viril et efficace;DVD 9 / 2.35, 16/9 compatible 4/3 / Master THX Digital / 5.1 ou DTS / LG : Fra / S-T : Eng + Fra pour sourds et malentendants / Commentaire audio d'Olivier Marchal.;POL;110';2008-01-27;36Quai.jpg;NULL;NULL
323;76441;LEGACY;1998;SCOTT T.J.;J. GRADY,scé. T.SCOTT, K.LUND,mus.E.DI BERARDO/Int.D. HASSELHOFF/D. ROSE/R. STEIGER...;Photographe de guerre, Jack Scott se retrouve à Manille, où Lana, une jeune femme, lui demande son aide pour retrouver son père Tous les deux deviennent la cible d'un groupe de mercenaires;DVD 5 / Son 2.0 / LG : Fra, Eng / S-T : Fra, Eng / Aucun bonus.;AVE;94';2008-01-27;legacy.jpg;NULL;NULL
324;76481;ROAD RAGE;1999;SARAFIAN D.;D. TAYLOR, B.ROSS,scé.D.TAYLOR,J.MANOS JR.,mus.J.MCNEELY/Int. Y. BLEETH/ J.BURNS A.AUSTIN...;Une erreur de conduite oblige Ellen à faire une queue de poisson à Eddie, un autre automobiliste Mal lui en a pris ! Eddie commence à la poursuivre et à la persécuter Inédit en salles;DVD 5 / Son 2.0 / LG : Fra, Eng / S-T : Fra / Aucun bonus.;POL;120';2008-01-27;road.jpg;NULL;NULL
325;56569;SPRING (THE );2000;JACKSON D.;C.IRVING, scé.J. WHITE,D. JACKSON,K. ROWELL,mus.P.GIFFIN/Int.A. EASTWOOD/ K. MC LACHLAN/J. CROSS...;Partis camper en forêt, un père et son fils arrivent dans une bourgade mystérieuse renfermant un secret mortel Un thriller surnaturel inédit en salles, avec l'acteur de Blue velvet;"Son dolby digital 2.0 / LG : Fra, Eng / S-T : Fra.
	";SFI;90';2008-01-27;spring.jpg;NULL;NULL
326; 	37311;ALWAYS;1989;Steven SPIELBERG;Richard Dreyfuss, Holly Hunter, John Goodman, Audrey Hepburn;Remake heureux du film de 1941 Un vrai mélo avec grands sentiments et grands moments spectaculaires, c'est efficace et réussi;"Standard  	DVD-9
Codage 	PAL
Format vidéo 	1.85:1, 4/3
Format audio 	Dolby Digital 4.1
Langues 	allemand, anglais, espagnol, français, italien
	
Sous-titres 	allemand, anglais, bulgare, danois,";COM;124';2009-02-01;always.jpg;NULL;NULL
327;23755;BEETLEJUICE;1988;Tim BURTON;Geena Davis, Michael Keaton, Alec Baldwin;Un délirant exercice d'humour noir pour tous les publics Les fantômes n'ont jamais été aussi drôles !;"Standard  	DVD-10
Codage 	PAL
Format vidéo 	1.85:1, 16/9 compatible 4/3
Format audio 	Dolby Digital 5.1
Langues 	anglais, français, italien
	
Sous-titres 	anglais, espagnol, français, italien, n";COM;92';2009-02-01;beetlejuice.jpg;NULL;NULL
